[kernel] Parsing crc32.c (with preprocessing)
[kernel:typing:implicit-function-declaration] crc32.c:22: Warning: 
  Calling undeclared function printf. Old style K&R code?
[eva] Analyzing a complete application starting at main
[eva:initial-state] Values of globals at initialization
  
[eva:partition] crc32.c:17: starting to merge loop iterations
[eva:alarm] crc32.c:17: Warning: 
  out of bounds read. assert \valid_read(test_str + len);
[eva:partition] crc32.c:6: starting to merge loop iterations
[kernel:annot:missing-spec] crc32.c:22: Warning: 
  Neither code nor specification for function printf,
   generating default assigns. See -generated-spec-* options for more info
[eva] using specification for function printf
[eva] ====== VALUES COMPUTED ======
[eva:final-states] Values at end of function crc32:
  hash ∈ [0..127]
[eva:final-states] Values at end of function main:
  test_str ∈ {{ "Hello, world!" }}
  len ∈ {13}
  checksum ∈ [0..127]
  __retres ∈ {0}
[eva:summary] ====== ANALYSIS SUMMARY ======
  ----------------------------------------------------------------------------
  2 functions analyzed (out of 2): 100% coverage.
  In these functions, 21 statements reached (out of 21): 100% coverage.
  ----------------------------------------------------------------------------
  Some errors and warnings have been raised during the analysis:
    by the Eva analyzer:      0 errors    0 warnings
    by the Frama-C kernel:    0 errors    2 warnings
  ----------------------------------------------------------------------------
  1 alarm generated by the analysis:
       1 invalid memory access
  ----------------------------------------------------------------------------
  No logical properties have been reached by the analysis.
  ----------------------------------------------------------------------------
[kernel] Parsing duff.c (with preprocessing)
[kernel:typing:implicit-function-declaration] duff.c:17: Warning: 
  Calling undeclared function printf. Old style K&R code?
[kernel] duff.c:19: User Error: Too many arguments in call to printf
[kernel] User Error: stopping on file "duff.c" that has errors. Add '-kernel-msg-key pp'
  for preprocessing command.
[kernel] Frama-C aborted: invalid user input.
[kernel] Parsing fizzbuzz.c (with preprocessing)
[eva] Analyzing a complete application starting at main
[eva:initial-state] Values of globals at initialization
  
[eva] using specification for function printf
[eva:partition] fizzbuzz.c:5: starting to merge loop iterations
[eva] ====== VALUES COMPUTED ======
[eva:final-states] Values at end of function fizzBuzz:
  i ∈ [31..2147483647]
  S___fc_stdout[0..1] ∈ [--..--]
[eva:final-states] Values at end of function main:
  __retres ∈ {0}
  S___fc_stdout[0..1] ∈ [--..--]
[eva:summary] ====== ANALYSIS SUMMARY ======
  ----------------------------------------------------------------------------
  2 functions analyzed (out of 2): 100% coverage.
  In these functions, 19 statements reached (out of 20): 95% coverage.
  ----------------------------------------------------------------------------
  No errors or warnings raised during the analysis.
  ----------------------------------------------------------------------------
  0 alarms generated by the analysis.
  ----------------------------------------------------------------------------
  Evaluation of the logical properties reached by the analysis:
    Assertions        0 valid     0 unknown     0 invalid      0 total
    Preconditions     4 valid     0 unknown     0 invalid      4 total
  100% of the logical properties reached have been proven.
  ----------------------------------------------------------------------------
[kernel] Parsing hamming.c (with preprocessing)
[kernel:typing:implicit-function-declaration] hamming.c:15: Warning: 
  Calling undeclared function printf. Old style K&R code?
[eva] Analyzing a complete application starting at main
[eva:initial-state] Values of globals at initialization
  
[eva:partition] hamming.c:4: starting to merge loop iterations
[kernel:annot:missing-spec] hamming.c:15: Warning: 
  Neither code nor specification for function printf,
   generating default assigns. See -generated-spec-* options for more info
[eva] using specification for function printf
[eva] ====== VALUES COMPUTED ======
[eva:final-states] Values at end of function hammingDistance:
  dist ∈ {0}
  val ∈ {0}
  __retres ∈ {0}
[eva:final-states] Values at end of function main:
  a ∈ {25}
  b ∈ {30}
  dist ∈ {0}
  __retres ∈ {0}
[eva:summary] ====== ANALYSIS SUMMARY ======
  ----------------------------------------------------------------------------
  2 functions analyzed (out of 2): 100% coverage.
  In these functions, 15 statements reached (out of 15): 100% coverage.
  ----------------------------------------------------------------------------
  Some errors and warnings have been raised during the analysis:
    by the Eva analyzer:      0 errors    0 warnings
    by the Frama-C kernel:    0 errors    2 warnings
  ----------------------------------------------------------------------------
  0 alarms generated by the analysis.
  ----------------------------------------------------------------------------
  No logical properties have been reached by the analysis.
  ----------------------------------------------------------------------------
[kernel] Parsing kahan.c (with preprocessing)
[kernel:parser:decimal-float] kahan.c:16: Warning: 
  Floating-point constant 3.14159 is not represented exactly. Will use 0x1.921f9f01b866ep1.
  (warn-once: no further messages from category 'parser:decimal-float' will be emitted)
[kernel:typing:implicit-function-declaration] kahan.c:20: Warning: 
  Calling undeclared function printf. Old style K&R code?
[eva] Analyzing a complete application starting at main
[eva:initial-state] Values of globals at initialization
  
[eva:partition] kahan.c:9: starting to merge loop iterations
[eva:alarm] kahan.c:12: Warning: 
  function sqrt: precondition 'arg_positive' got status unknown.
[kernel:annot:missing-spec] kahan.c:20: Warning: 
  Neither code nor specification for function printf,
   generating default assigns. See -generated-spec-* options for more info
[eva] using specification for function printf
[eva] ====== VALUES COMPUTED ======
[eva:final-states] Values at end of function kahanSum:
  sumSquares ∈ [-3.40282346639e+38 .. 3.40282346639e+38]
  __retres ∈ [-0. .. 8.24963449661e+18]
[eva:final-states] Values at end of function main:
  values[0] ∈ {10000000000.}
        [1] ∈ {3.14159}
        [2] ∈ {2.71828}
        [3] ∈ {-10000000000.}
        [4] ∈ {1e-05}
  n ∈ {5}
  result ∈ [-0. .. 8.24963449661e+18]
  __retres ∈ {0}
[eva:summary] ====== ANALYSIS SUMMARY ======
  ----------------------------------------------------------------------------
  2 functions analyzed (out of 2): 100% coverage.
  In these functions, 19 statements reached (out of 22): 86% coverage.
  ----------------------------------------------------------------------------
  Some errors and warnings have been raised during the analysis:
    by the Eva analyzer:      0 errors    0 warnings
    by the Frama-C kernel:    0 errors    3 warnings
  ----------------------------------------------------------------------------
  0 alarms generated by the analysis.
  ----------------------------------------------------------------------------
  Evaluation of the logical properties reached by the analysis:
    Assertions        0 valid     0 unknown     0 invalid      0 total
    Preconditions     1 valid     1 unknown     0 invalid      2 total
  50% of the logical properties reached have been proven.
  ----------------------------------------------------------------------------
[kernel] Parsing kmp.c (with preprocessing)
[kernel:typing:implicit-function-declaration] kmp.c:24: Warning: 
  Calling undeclared function printf. Old style K&R code?
[kernel] kmp.c:26: User Error: Too few arguments in call to printf.
[kernel] User Error: stopping on file "kmp.c" that has errors. Add '-kernel-msg-key pp'
  for preprocessing command.
[kernel] Frama-C aborted: invalid user input.
[kernel] Parsing levenshtein.c (with preprocessing)
[kernel] levenshtein.c:3: Frama-C aborted: unimplemented feature.
  You may send a feature request at https://git.frama-c.com/pub/frama-c/issues with:
  '[Frama-C] For multi-dimensional arrays, variable length is only supported on the first dimension'.
Running Frama-C EVA and exporting alarms to CSV...
✅ CSV report generated: eva_report.csv
[kernel] Parsing rabinkarp.c (with preprocessing)
[kernel] rabinkarp.c:32: User Error: Too many arguments in call to rabinKarp
[kernel] rabinkarp.c:32: User Error: 
  Cannot resolve variable PRIME
  30        int patternLength = sizeof(pattern) - 1;
  31    
  32        int index = rabinKarp(text, textLength, pattern, patternLength, PRIME);
                                                                            ^^^^^
  33    
  34        if (index != -1) {
[kernel] Frama-C aborted: invalid user input.
[kernel] Parsing sieve.c (with preprocessing)
[kernel:typing:implicit-function-declaration] sieve.c:16: Warning: 
  Calling undeclared function printf. Old style K&R code?
[kernel] sieve.c:22: User Error: Too few arguments in call to printf.
[kernel] User Error: stopping on file "sieve.c" that has errors. Add '-kernel-msg-key pp'
  for preprocessing command.
[kernel] Frama-C aborted: invalid user input.
[kernel] Parsing sqrt.c (with preprocessing)
[kernel:typing:implicit-function-declaration] sqrt.c:14: Warning: 
  Calling undeclared function printf. Old style K&R code?
[eva] Analyzing a complete application starting at main
[eva:initial-state] Values of globals at initialization
  
[kernel:annot:missing-spec] sqrt.c:14: Warning: 
  Neither code nor specification for function printf,
   generating default assigns. See -generated-spec-* options for more info
[eva] using specification for function printf
[eva:partition] sqrt.c:11: starting to merge loop iterations
[eva] ====== VALUES COMPUTED ======
[eva:final-states] Values at end of function fastInvSqrt:
  i ∈ [1048576000..1092616192]
  __retres ∈ [-2. .. 3.]
[eva:final-states] Values at end of function main:
  values[0] ∈ {1.}
        [1] ∈ {2.}
        [2] ∈ {0.5}
        [3] ∈ {10.}
        [4] ∈ {0.25}
  n ∈ {5}
  __retres ∈ {0}
[eva:summary] ====== ANALYSIS SUMMARY ======
  ----------------------------------------------------------------------------
  2 functions analyzed (out of 2): 100% coverage.
  In these functions, 17 statements reached (out of 17): 100% coverage.
  ----------------------------------------------------------------------------
  Some errors and warnings have been raised during the analysis:
    by the Eva analyzer:      0 errors    0 warnings
    by the Frama-C kernel:    0 errors    2 warnings
  ----------------------------------------------------------------------------
  0 alarms generated by the analysis.
  ----------------------------------------------------------------------------
  No logical properties have been reached by the analysis.
  ----------------------------------------------------------------------------
[kernel] Parsing strassen.c (with preprocessing)
[kernel:typing:implicit-function-declaration] strassen.c:22: Warning: 
  Calling undeclared function printf. Old style K&R code?
[kernel] strassen.c:25: User Error: Too many arguments in call to printf
[kernel] User Error: stopping on file "strassen.c" that has errors. Add '-kernel-msg-key pp'
  for preprocessing command.
[kernel] Frama-C aborted: invalid user input.
[kernel] Parsing voting.c (with preprocessing)
[kernel:typing:implicit-function-declaration] voting.c:30: Warning: 
  Calling undeclared function printf. Old style K&R code?
[eva] Analyzing a complete application starting at main
[eva:initial-state] Values of globals at initialization
  
[eva:partition] voting.c:7: starting to merge loop iterations
[eva:alarm] voting.c:9: Warning: 
  signed overflow. assert freq + 1 ≤ 2147483647;
[kernel:annot:missing-spec] voting.c:30: Warning: 
  Neither code nor specification for function printf,
   generating default assigns. See -generated-spec-* options for more info
[eva] using specification for function printf
[eva] ====== VALUES COMPUTED ======
[eva:final-states] Values at end of function majorityElement:
  candidate ∈ {1; 2; 3}
  count ∈ {1}
  freq ∈ [0..2147483647]
[eva:final-states] Values at end of function main:
  arr1[0..1] ∈ {2}
      [2..4] ∈ {1}
      [5..6] ∈ {2}
  size1 ∈ {7}
  arr2[0..1] ∈ {3}
      [2] ∈ {4}
      [3] ∈ {2}
      [4..5] ∈ {4}
      [6] ∈ {2}
      [7..8] ∈ {4}
  size2 ∈ {9}
  arr3[0] ∈ {1}
      [1] ∈ {2}
      [2] ∈ {3}
      [3] ∈ {4}
  size3 ∈ {4}
  res1 ∈ {-1; 2}
  res2 ∈ {-1; 3}
  res3 ∈ {-1; 1}
  __retres ∈ {0}
[eva:summary] ====== ANALYSIS SUMMARY ======
  ----------------------------------------------------------------------------
  2 functions analyzed (out of 2): 100% coverage.
  In these functions, 30 statements reached (out of 30): 100% coverage.
  ----------------------------------------------------------------------------
  Some errors and warnings have been raised during the analysis:
    by the Eva analyzer:      0 errors    0 warnings
    by the Frama-C kernel:    0 errors    2 warnings
  ----------------------------------------------------------------------------
  1 alarm generated by the analysis:
       1 integer overflow
  ----------------------------------------------------------------------------
  No logical properties have been reached by the analysis.
  ----------------------------------------------------------------------------
